{
  "eventType": "notification.sent",
  "version": "1.0.0",
  "timestamp": "2025-10-13T07:45:00Z",
  "eventId": "550e8400-e29b-41d4-a716-446655440000",
  "payload": {
    "notificationId": "notif-12345",
    "recipientId": "user-67890",
    "channel": "email",
    "message": {
      "subject": "Welcome to NCF",
      "body": "Thank you for joining our notification system.",
      "priority": "normal"
    },
    "status": "sent"
  },
  "metadata": {
    "source": "notification-service",
    "correlationId": "660e8400-e29b-41d4-a716-446655440000",
    "userId": "user-67890"
  }
}
